{
  "id": "ds.dsu",
  "title": "并查集",
  "category": [
    "数据结构",
    "并查集"
  ],
  "learningOrder": 110,
  "tags": [
    "data-structure",
    "dsu",
    "union-find"
  ],
  "timeComplexity": "O(alpha(n))",
  "spaceComplexity": "O(n)",
  "brief": "维护动态连通块，支持合并集合和查询代表元。",
  "detail": "并查集维护不相交集合，路径压缩配合按大小/秩合并后单次操作均摊接近常数。它适合连通性、Kruskal 和离线合并；如果需要撤销历史状态，不能使用普通路径压缩，应换成可撤销并查集。",
  "codeLanguage": "cpp",
  "source": {
    "name": "XCPC Super Template original",
    "license": "GPL-3.0-only"
  },
  "updatedAt": "2026-06-11"
}
