{
  "id": "math.number-theory.extgcd",
  "title": "扩展欧几里得",
  "category": [
    "数学与数论",
    "基础数论"
  ],
  "learningOrder": 410,
  "tags": [
    "math",
    "gcd",
    "inverse"
  ],
  "timeComplexity": "O(log min(a, b))",
  "spaceComplexity": "O(log min(a, b))",
  "brief": "求 ax + by = gcd(a, b) 的一组整数解。",
  "detail": "扩展欧几里得求 ax + by = gcd(a,b) 的一组整数解，是线性同余、模逆元和 CRT 的基础。只有 gcd(a,mod)=1 时普通乘法逆元存在；处理负数时要把结果规范到 [0, mod)。",
  "codeLanguage": "cpp",
  "source": {
    "name": "XCPC Super Template sample",
    "license": "GPL-3.0-only"
  },
  "updatedAt": "2026-06-10"
}
